<?xml version="1.0" encoding="utf-8"?>

<!DOCTYPE CorpusAnnote SYSTEM "exercice11.dtd">

<?xml-stylesheet type="application/xml" href="exercice11c.xsl"?>

<CorpusAnnote>
	<pair id="3000">
		<phraseEN>your honour , i move to disqualify miss vito as a expert witness .</phraseEN>
		<phraseFR>je récuse sa compétence d' experte .</phraseFR>
		<annot1>First annotation: partial; untranslated source word indices: 0 1 2; untranslated target word indices: </annot1>
		<annot2>Second annotation: partial; untranslated source word indices: 0 1 2; untranslated target word indices: </annot2>
	</pair>
	<pair id="3001">
		<phraseEN>i was n't thinking clearly .</phraseEN>
		<phraseFR>mon esprit n' était pas clair .</phraseFR>
		<annot1>First annotation: unperfect</annot1>
		<annot2>Second annotation: sure</annot2>
	</pair>
	<pair id="3002">
		<phraseEN>i calculated his body weight .</phraseEN>
		<phraseFR>j' ai calculé sa masse corporelle .</phraseFR>
		<annot1>First annotation: sure</annot1>
		<annot2>Second annotation: sure</annot2>
	</pair>
	<pair id="3003">
		<phraseEN>- i 'm really touched .</phraseEN>
		<phraseFR>- je suis touché . - il y a de quoi .</phraseFR>
		<annot1>First annotation: partial; untranslated source word indices: ; untranslated target word indices: 6 7 8 9 10</annot1>
		<annot2>Second annotation: partial; untranslated source word indices: ; untranslated target word indices: 5 6 7 8 9 10 11</annot2>
	</pair>
	<pair id="3004">
		<phraseEN>you say it wearies you .</phraseEN>
		<phraseFR>vous dites qu' elle vous fatigue aussi .</phraseFR>
		<annot1>First annotation: sure</annot1>
		<annot2>Second annotation: sure</annot2>
	</pair>
	<pair id="3005">
		<phraseEN>lead us not into temptation , but deliver us from evil .</phraseEN>
		<phraseFR>" libère nous de la tentation , " " et délivre nous du mal . "</phraseFR>
		<annot1>First annotation: sure</annot1>
		<annot2>Second annotation: sure</annot2>
	</pair>
	<pair id="3006">
		<phraseEN>- somebody rebuilt it .</phraseEN>
		<phraseFR>- quelqu'un l' a reconstruit .</phraseFR>
		<annot1>First annotation: sure</annot1>
		<annot2>Second annotation: sure</annot2>
	</pair>
	<pair id="3007">
		<phraseEN>- no , i fucking wo n't keep my voice down !</phraseEN>
		<phraseFR>- je crierai si j' en ai envie !</phraseFR>
		<annot1>First annotation: unperfect</annot1>
		<annot2>Second annotation: unperfect</annot2>
	</pair>
	<pair id="3008">
		<phraseEN>repeat : lower your altitude to 20,000 ft.</phraseEN>
		<phraseFR>je répète : descendez à 7000 m.</phraseFR>
		<annot1>First annotation: partial; untranslated source word indices: 3 4; untranslated target word indices: </annot1>
		<annot2>Second annotation: sure</annot2>
	</pair>
	<pair id="3009">
		<phraseEN>loretta , i 'm already expelled .</phraseEN>
		<phraseFR>loretta , vous m' avez déjà expulsé .</phraseFR>
		<annot1>First annotation: sure</annot1>
		<annot2>Second annotation: sure</annot2>
	</pair>
	<pair id="3010">
		<phraseEN>we got the killer 's god damn dna ?</phraseEN>
		<phraseFR>on a l' adn du tueur ?</phraseFR>
		<annot1>First annotation: sure</annot1>
		<annot2>Second annotation: sure</annot2>
	</pair>
	<pair id="3011">
		<phraseEN>- may we stay this happy forever .</phraseEN>
		<phraseFR>- puisse ce bonheur être éternel .</phraseFR>
		<annot1>First annotation: sure</annot1>
		<annot2>Second annotation: sure</annot2>
	</pair>
	<pair id="3012">
		<phraseEN>you can go ahead and try and engage him .</phraseEN>
		<phraseFR>allez -y , essayez de le viser .</phraseFR>
		<annot1>First annotation: sure</annot1>
		<annot2>Second annotation: sure</annot2>
	</pair>
	<pair id="3013">
		<phraseEN>i would do as he asks .</phraseEN>
		<phraseFR>vous feriez bien de l' écouter .</phraseFR>
		<annot1>First annotation: unperfect</annot1>
		<annot2>Second annotation: unperfect</annot2>
	</pair>
	<pair id="3014">
		<phraseEN>and i saw the top-secret file to prove it .</phraseEN>
		<phraseFR>j' ai vu le dossier ultrasecret qui le prouve .</phraseFR>
		<annot1>First annotation: sure</annot1>
		<annot2>Second annotation: sure</annot2>
	</pair>
	<pair id="3015">
		<phraseEN>you have to get your people out .</phraseEN>
		<phraseFR>il faut faire évacuer .</phraseFR>
		<annot1>First annotation: sure</annot1>
		<annot2>Second annotation: sure</annot2>
	</pair>
	<pair id="3016">
		<phraseEN>- whipped cream or berry ?</phraseEN>
		<phraseFR>- crème fouettée ou petits fruits ?</phraseFR>
		<annot1>First annotation: sure</annot1>
		<annot2>Second annotation: sure</annot2>
	</pair>
	<pair id="3017">
		<phraseEN>just keep walkin ' , keep walkin ' .</phraseEN>
		<phraseFR>avance . et voilà .</phraseFR>
		<annot1>First annotation: unperfect</annot1>
		<annot2>Second annotation: unperfect</annot2>
	</pair>
	<pair id="3018">
		<phraseEN>how much do you know about electricity ?</phraseEN>
		<phraseFR>tu t' y connais en électricité ?</phraseFR>
		<annot1>First annotation: sure</annot1>
		<annot2>Second annotation: sure</annot2>
	</pair>
	<pair id="3019">
		<phraseEN>hamburgers , where are you ? .</phraseEN>
		<phraseFR>hamburgers ; où êtes vous ?</phraseFR>
		<annot1>First annotation: sure</annot1>
		<annot2>Second annotation: sure</annot2>
	</pair>
	<pair id="3020">
		<phraseEN>and that 's the way i live</phraseEN>
		<phraseFR>et je vis comme ça</phraseFR>
		<annot1>First annotation: sure</annot1>
		<annot2>Second annotation: sure</annot2>
	</pair>
	<pair id="3021">
		<phraseEN>she 's down to fuck , man .</phraseEN>
		<phraseFR>prête à baiser , mec .</phraseFR>
		<annot1>First annotation: partial; untranslated source word indices: 0 1; untranslated target word indices: </annot1>
		<annot2>Second annotation: unperfect</annot2>
	</pair>
	<pair id="3022">
		<phraseEN>- how can i hold the presents ?</phraseEN>
		<phraseFR>- à la main ?</phraseFR>
		<annot1>First annotation: not corresponding</annot1>
		<annot2>Second annotation: not corresponding</annot2>
	</pair>
	<pair id="3023">
		<phraseEN>i 'm just saying , you know , fabula is a lot less possessive than she used to be .</phraseEN>
		<phraseFR>fabula est beaucoup moins possessive qu' avant .</phraseFR>
		<annot1>First annotation: partial; untranslated source word indices: 0 1 2 3 4 5 6; untranslated target word indices: </annot1>
		<annot2>Second annotation: partial; untranslated source word indices: 0 1 2 3 4 5 6; untranslated target word indices: </annot2>
	</pair>
	<pair id="3024">
		<phraseEN>ok , you 're right .</phraseEN>
		<phraseFR>ok , vous avez raison .</phraseFR>
		<annot1>First annotation: sure</annot1>
		<annot2>Second annotation: sure</annot2>
	</pair>
	<pair id="3025">
		<phraseEN>now , could aaron stampler have been present during the murder of archbishop rushman ...</phraseEN>
		<phraseFR>aaron stampler pouvait -il être présent au moment du meurtre</phraseFR>
		<annot1>First annotation: partial; untranslated source word indices: 0 1 11 12 13 14; untranslated target word indices: </annot1>
		<annot2>Second annotation: partial; untranslated source word indices: 0 1 11 12 13 14; untranslated target word indices: </annot2>
	</pair>
	<pair id="3026">
		<phraseEN>three minutes , i can have power back on in the entire park .</phraseEN>
		<phraseFR>j' aurai rétabli le courant dans trois minutes .</phraseFR>
		<annot1>First annotation: partial; untranslated source word indices: 9 10 11 12; untranslated target word indices: </annot1>
		<annot2>Second annotation: partial; untranslated source word indices: 9 10 11 12; untranslated target word indices: </annot2>
	</pair>
	<pair id="3027">
		<phraseEN>he could 've shot your damn head off !</phraseEN>
		<phraseFR>il aurait pu t' arracher toute la tête !</phraseFR>
		<annot1>First annotation: sure</annot1>
		<annot2>Second annotation: sure</annot2>
	</pair>
	<pair id="3028">
		<phraseEN>that depends , gentlemen .</phraseEN>
		<phraseFR>ça dépend , messieurs .</phraseFR>
		<annot1>First annotation: sure</annot1>
		<annot2>Second annotation: sure</annot2>
	</pair>
	<pair id="3029">
		<phraseEN>miami . you do whatever work comes your way .</phraseEN>
		<phraseFR>vous faites n' importe quel job qui se présente .</phraseFR>
		<annot1>First annotation: sure</annot1>
		<annot2>Second annotation: sure</annot2>
	</pair>
	<pair id="3030">
		<phraseEN>that 's the way a clock works .</phraseEN>
		<phraseFR>pourquoi " joli " ?</phraseFR>
		<annot1>First annotation: not corresponding</annot1>
		<annot2>Second annotation: not corresponding</annot2>
	</pair>
	<pair id="3031">
		<phraseEN>we had a pretty tough season , so naturally , the show went into the red .</phraseEN>
		<phraseFR>on a eu une saison assez dure , alors , le spectacle était dans le rouge .</phraseFR>
		<annot1>First annotation: sure</annot1>
		<annot2>Second annotation: sure</annot2>
	</pair>
	<pair id="3032">
		<phraseEN>brad and i are watching the house .</phraseEN>
		<phraseFR>brad et moi gardons la maison .</phraseFR>
		<annot1>First annotation: sure</annot1>
		<annot2>Second annotation: sure</annot2>
	</pair>
	<pair id="3033">
		<phraseEN>how many buildings in town is that ?</phraseEN>
		<phraseFR>ça fait combien de bâtiments ça ?</phraseFR>
		<annot1>First annotation: partial; untranslated source word indices: 3 4; untranslated target word indices: </annot1>
		<annot2>Second annotation: partial; untranslated source word indices: 3 4; untranslated target word indices: </annot2>
	</pair>
	<pair id="3034">
		<phraseEN>uh , no. . . party sounds awesome , dude .</phraseEN>
		<phraseFR>la fête a l' air génial .</phraseFR>
		<annot1>First annotation: sure</annot1>
		<annot2>Second annotation: sure</annot2>
	</pair>
	<pair id="3035">
		<phraseEN>if that 's the way it was , can you ever forgive me ?</phraseEN>